{
  "version": 1,
  "name": "fork-readonly-shared-references",
  "sourceStore": "source-machine:codex:store-a",
  "destinationStore": "destination-machine:codex:store-b",
  "continuity": {
    "intent": "fork",
    "sourceWriter": "active"
  },
  "identity": {
    "policy": "native-fork-id",
    "sourceSession": "example-parent",
    "destinationSession": null
  },
  "history": {
    "binding": "native-fork",
    "writerAuthority": "destination-exclusive",
    "resourceId": "primary-history"
  },
  "cwd": {
    "logicalPolicy": "remapped",
    "namespace": "host",
    "requestedPath": "C:/AgentSystems/Agent_A_branch",
    "extent": "selected-closure"
  },
  "instructions": "overlay",
  "tools": "pin-source",
  "topology": "require-verified-native",
  "resources": [
    {
      "id": "agent-workspace",
      "kind": "workspace",
      "materialization": "snapshot-copy",
      "targetRole": "destination-working",
      "access": "read-write",
      "sharingGroup": null,
      "sourcePath": "C:/Office/Agent_A",
      "destinationPath": "C:/AgentSystems/Agent_A_branch"
    },
    {
      "id": "primary-history",
      "kind": "history",
      "materialization": "native-harness",
      "targetRole": "destination-working",
      "access": "read-write",
      "sharingGroup": null,
      "sourcePath": "source-store:/sessions/example-parent",
      "destinationPath": "destination-store:/sessions/<native-fork-id>"
    },
    {
      "id": "common-learning-library",
      "kind": "identity-memory",
      "materialization": "symlink",
      "targetRole": "shared-live",
      "access": "read-only",
      "sharingGroup": "shared-learning-library",
      "sourcePath": "C:/Shared/Learning",
      "destinationPath": "C:/AgentSystems/Agent_A_branch/references"
    }
  ],
  "references": [
    {
      "consumer": "workspace-relative references",
      "basis": "cwd-relative",
      "resolution": "preserve-layout",
      "status": "unverified"
    },
    {
      "consumer": "old absolute paths",
      "basis": "absolute",
      "resolution": "configure",
      "status": "unverified"
    }
  ],
  "capabilities": {
    "historyCoordination": "unneeded",
    "evidence": [],
    "requiredAcceptance": "unverified"
  },
  "executionReady": false,
  "blockers": [
    "Verify independent histories and workspaces; establish read-only enforcement for the shared reference library. A symlink alone does not enforce it."
  ]
}
